{"authority_digest":"0000000000000000000000000000000000000000000000000000000000000010","byte_count":512,"dependency_digests":["0000000000000000000000000000000000000000000000000000000000000013"],"file_count":2,"input_digest":"0000000000000000000000000000000000000000000000000000000000000014","journal_schema":"kilix.content.transaction/v1","output_format_version":1,"sandbox_digest":"0000000000000000000000000000000000000000000000000000000000000016","schema":"kilix.content.output-binding/v1","selected_tree_digest":"0000000000000000000000000000000000000000000000000000000000000017","source_digest":"0000000000000000000000000000000000000000000000000000000000000012","toolchain_digest":"0000000000000000000000000000000000000000000000000000000000000015"}
